{
  "$schema": "https://json-schema.org/draft/2020-12/schema",
  "$id": "https://schemas.kumwe.org/studio/v1/renderer-web-vector.schema.json",
  "title": "Studio renderer-web conformance vector",
  "type": "object",
  "additionalProperties": false,
  "required": ["id", "roots", "bindings", "media", "expect"],
  "properties": {
    "id": { "$ref": "common.schema.json#/$defs/stableId" },
    "roots": {
      "type": "array",
      "minItems": 1,
      "maxItems": 100,
      "items": { "$ref": "blueprint.schema.json#/$defs/node" }
    },
    "bindings": {
      "type": "array",
      "maxItems": 1000,
      "items": {
        "type": "object",
        "additionalProperties": false,
        "required": ["nodeId", "port", "value"],
        "properties": {
          "nodeId": { "$ref": "common.schema.json#/$defs/stableId" },
          "port": { "$ref": "common.schema.json#/$defs/localName" },
          "value": { "$ref": "common.schema.json#/$defs/jsonValue" }
        }
      }
    },
    "media": {
      "type": "array",
      "maxItems": 1000,
      "items": {
        "type": "object",
        "additionalProperties": false,
        "required": ["assetId", "src", "altText"],
        "properties": {
          "assetId": { "$ref": "common.schema.json#/$defs/stableId" },
          "src": { "type": "string", "minLength": 1, "maxLength": 2048 },
          "altText": { "type": "string", "maxLength": 5000 },
          "caption": { "type": "string", "maxLength": 20000 },
          "width": { "type": "integer", "minimum": 1, "maximum": 100000 },
          "height": { "type": "integer", "minimum": 1, "maximum": 100000 }
        }
      }
    },
    "expect": {
      "type": "object",
      "additionalProperties": false,
      "required": ["htmlContains", "htmlExcludes", "cssContains", "enhancements"],
      "properties": {
        "htmlContains": {
          "type": "array",
          "maxItems": 100,
          "items": { "type": "string", "maxLength": 10000 }
        },
        "htmlExcludes": {
          "type": "array",
          "maxItems": 100,
          "items": { "type": "string", "maxLength": 10000 }
        },
        "cssContains": {
          "type": "array",
          "maxItems": 100,
          "items": { "type": "string", "maxLength": 10000 }
        },
        "enhancements": {
          "type": "array",
          "maxItems": 100,
          "items": {
            "enum": [
              "chart",
              "countdown",
              "diagram",
              "dialog",
              "lightbox",
              "math",
              "motion",
              "notice",
              "popover",
              "slideshow",
              "tabs"
            ]
          }
        }
      }
    }
  }
}
