{
  "id": "renderer-web/escaped-heading",
  "roots": [
    {
      "authoring": { "mode": "content" },
      "bindings": {},
      "id": "heading",
      "properties": { "level": 2 },
      "slots": {},
      "type": "studio.core/heading",
      "version": "1.0.0"
    }
  ],
  "bindings": [{ "nodeId": "heading", "port": "text", "value": "<script>alert(1)</script>" }],
  "media": [],
  "expect": {
    "htmlContains": ["&lt;script&gt;alert(1)&lt;/script&gt;"],
    "htmlExcludes": ["<script"],
    "cssContains": ["prefers-reduced-motion"],
    "enhancements": []
  }
}
